ORDEM DO MÉRITO AERONÁUTICO;;;;;;;
;;;;;;;
INSÍGNIAS - INSTITUIÇÕES;;;;;;;
;;;;;;;
(Atualizada até Novembro de 2024);;;;;;;
;;;;;;;
NR;SIGLA_ORG;DESCRIÇÃO;INSTITUICÃO;CATEG;DT_INSIG;DT_DOU;REG
1;AFA;Academia da Força Aérea;Aeronáutica;Estandarte;08/03/1946;;134
2;AMAN;Academia Militar das Agulhas Negras;Exército;Estandarte;02/10/1978;03/10/1978;3121
3;ANE;Academia Nacional de Engenharia;Outros;Estandarte;01/10/2003;02/10/2003;
4;;Aéro-Club de France;Outros;;07/06/2006;08/06/2006;
5;AT-1;Aeródromo de Trânsito nº 1;Força Aérea Portuguesa;Estandarte;23/10/2013;23/10/2013;12110
6;AirU-EUA;Air University dos Estados Unidos da América;USAF;Bandeira;29/09/1966;30/09/1966;1426
7;;Andrews Air Force Base;Outros;Estandarte;26/09/2005;27/09/2005;9484
8;ASPAER;Assessoria Parlamentar e de Relações Institucionais do Comandante da Aeronáutica;Aeronáutica;Estandarte;21/10/2022;21/10/2022;201
9;ADESG;Associação dos Diplomados da Escola Superior de Guerra;Outros;Estandarte;23/09/1997;24/09/1997;7128
10;BAAN;Base Aérea de Anápolis;Aeronáutica;Bandeira;02/10/1978;03/10/1978;3119
11;BABE;Base Aérea de Belém;Aeronáutica;Estandarte;20/09/1984;25/09/1984;4471
12;BABV;Base Aérea de Boa Vista;Aeronáutica;Estandarte;20/09/2006;21/09/2006;9498
13;BABR;Base Aérea de Brasília;Aeronáutica;Estandarte;12/09/1990;11/10/1990;5818
14;BACG;Base Aérea de Campo Grande;Aeronáutica;Estandarte;20/09/1984;25/09/1984;4472
15;BACO;Base Aérea de Canoas;Aeronáutica;Estandarte;20/09/1983;27/09/1983;4152
16;BAFL;Base Aérea de Florianópolis;Aeronáutica;Estandarte;20/09/1984;25/09/1984;4473
17;BAFZ;Base Aérea de Fortaleza;Aeronáutica;Estandarte;20/09/1985;23/09/1985;4720
18;BAMN;Base Aérea de Manaus;Aeronáutica;Estandarte;01/10/2003;02/10/2003;8981
19;BANT;Base Aérea de Natal;Aeronáutica;Estandarte;05/10/2021;06/10/2021;14889
20;BAPV;Base Aérea de Porto Velho;Aeronáutica;Estandarte;17/05/1984;;
21;BARF;Base Aérea de Recife;Aeronáutica;Estandarte;20/09/1984;25/09/1984;4474
22;BASV;Base Aérea de Salvador;Aeronáutica;Estandarte;01/09/1987;02/09/1987;5044
23;BASC;Base Aérea de Santa Cruz;Aeronáutica;Bandeira;15/09/1982;01/10/1982;3909
24;BASM;Base Aérea de Santa Maria;Aeronáutica;Estandarte;08/09/1989;22/09/1989;5529
25;BAST;Base Aérea de Santos;Aeronáutica;Estandarte;18/09/1991;25/09/1991;5849
26;BASP;Base Aérea de São Paulo;Aeronáutica;Estandarte;16/09/1986;22/09/1986;4812
27;BAGL;Base Aérea do Galeão;Aeronáutica;Bandeira;15/10/1963;16/10/1963;1191
28;BAAF;Base Aérea dos Afonsos;Aeronáutica;Bandeira;15/10/1963;16/10/1963;1192
29;BAENSPA;Base Aérea Naval de São Pedro da Aldeia;Marinha;Estandarte;14/10/1992;15/10/1992;6223
30;Ba1;Base Aérea Nº 1 (Ba1);Exterior;Estandarte;01/10/1939;13/10/2016;13158
31;Ba Adm Ap/ 1 RM;Base de Administração e Apoio da 1ª Região Militar;Exército;Estandarte;02/10/2017;03/10/2017;13491
32;BGP;Batalhão da Guarda Presidencial de Brasília;Exército;Bandeira;18/10/1961;20/10/1961;813
33;11° RI;Batalhão de Infantaria de Montanha - Regimento Tiradentes;Exército;Estandarte;01/10/2003;02/10/2003;8986
34;1° BIM;Batalhão de Infantaria Motorizado - Regimento Sampaio;Exército;Estandarte;01/10/2003;02/10/2003;8984
35;Bibl-Ex;Biblioteca do Exército;Exército;Bandeira;25/11/1980;04/12/1980;3677
36;BdaAT-Ex;Brigada Aero-Terrestre;Exército;Bandeira;19/10/1970;19/10/1970;1992
37;BdaAv-Ex;Brigada de Aviação do Exército;Exército;Estandarte;14/10/1992;15/10/1992;6224
38;CGABEG;Casa Gerontológica de Aeronáutica Brigadeiro Eduardo Gomes;Aeronáutica;Estandarte;26/09/2005;27/09/2005;9473
39;CATRE;Centro de Aplicações e Recompletamento de Equipagens;Aeronáutica;Estandarte;20/09/1983;27/09/1983;4151
40;CECOMSAER;Centro de Comunicação Social da Aeronáutica;Aeronáutica;Estandarte;30/09/2010;01/10/2010;11066
41;CGNA;Centro de Gerenciamento da Navegação Aérea;Aeronáutica;Estandarte;13/10/2020;14/10/2020;14573
42;CIAW;Centro de Instrução Almirante Wandenkolk;Marinha;Estandarte;17/10/2002;18/10/2002;8599
43;CIAV;Centro de Instrução de Aviação do Exército;Exército;;20/09/2006;21/09/2006;9501
44;CIAAR;Centro de Instrução e Adaptação da Aeronáutica;Aeronáutica;Estandarte;06/07/2005;22/10/2014;12476
45;CIAAN;Centro de Instrução e Adestramento Aeronaval;Marinha;Estandarte;20/09/2006;21/09/2006;9500
46;CIPQD-Ex;Centro de Instrução Pára-Quedista Gen Penha Brasil;Exército;Estandarte;20/09/1985;23/09/1985;4722
47;CENIPA;Centro de Investigação e Prevenção de Acidentes Aeronáuticos;Aeronáutica;Estandarte;01/10/2003;02/10/2003;8982
48;CLBI;Centro de Lançamento da Barreira do Inferno;Aeronáutica;Estandarte;17/03/1972;21/10/2015;12833
49;CEMAL;Centro de Medicina Aeroespacial;Aeronáutica;Estandarte;26/09/2001;27/09/2001;8364
50;CPORAER-SJ;Centro de Preparação de Oficiais da Reserva da Aeronáutica;Aeronáutica;Estandarte;20/08/1971;20/09/2019;14265
51;CELOG;Centro Logístico da Aeronáutica;Aeronáutica;Estandarte;04/10/2007;05/10/2007;9999
52;CTA;Centro Técnico Aeroespacial;Aeronáutica;Estandarte;20/09/1983;27/09/1983;4150
53;CESUPA;Centro Universitário do Pará;Outros;Bandeira;01/10/1986;16/10/2018;13504
54;PISA;Cidade de Pisa;República Italiana;Bandeira;11/09/1996;12/09/1996;7116
55;CID;Colégio Interamericano de Defesa;Exterior;Estandarte;02/10/2017;03/10/2017;13488
56;CMAv-BO;Colégio Militar de Aviação da Força Aérea Boliviana;Força Aé. Boliviana;Estandarte;08/06/1973;11/06/1973;2214
57;CMB;Colégio Militar de Brasília;Exército;Estandarte;07/10/1994;13/10/1994;
58;CMFZ;Colégio Militar de Fortaleza;Exército;Estandarte;13/10/1969;23/10/1969;1890
59;CMPA;Colégio Militar de Porto Alegre;Exército;Estandarte;09/10/1972;10/10/1972;2207
60;CMRJ;Colégio Militar do Rio de Janeiro;Exército;Estandarte;14/10/1958;20/10/1958;584
61;COMAT;Comando Aerotático;Aeronáutica;Bandeira;15/09/1982;01/10/1982;3908
62;MAER;Comando da Aeronáutica;Aeronáutica;Estandarte;11/09/1996;12/09/1996;7119
63;CFAe-Mar;Comando da Força Aeronaval;Marinha;Estandarte;20/09/1985;23/09/1985;4721
64;CMDO F. CT;Comando da Força de Contra-Torpedeiros;Marinha;Estandarte;14/10/1992;15/10/1992;6265
65;COMDO FRAG;Comando da Força de Fragatas;Marinha;Estandarte;21/09/1995;22/09/1995;
66;COMFFE;Comando da Força de Fuzileiros da Esquadra;Marinha;Estandarte;19/10/2012;22/10/2012;11795
67;5ª DE;Comando da Quinta Divisão do Exército;Exército;Estandarte;13/10/2020;14/10/2020;14572
68;COMDABRA;Comando de Defesa Aeroespacial Brasileiro;Aeronáutica;Estandarte;26/09/2001;27/09/2001;8363
69;COM;Comando de Operações Navais;Marinha;Estandarte;26/09/2000;27/09/2000;
70;COTer;Comando de Operações Terrestres;Exército;Estandarte;06/09/2004;08/09/2004;9231
71;1° DN-CMD;Comando do Primeiro Distrito Naval;Marinha;Estandarte;04/10/2007;05/10/2007;10002
72;COM4DN;Comando do Quarto Distrito Naval;Marinha;Estandarte;19/11/1945;16/10/2018;13503
73;COMTA;Comando do Transporte Aéreo;Aeronáutica;Bandeira;09/10/1956;11/10/1956;399
74;COLOG;Comando Logístico;Exército;Estandarte;21/10/2022;21/10/2022;201
75;CMA;Comando Militar da Amazônia;Exército;Estandarte;07/10/1994;13/10/1994;
76;CML;Comando Militar do Leste;Exército;Estandarte;29/09/2009;30/09/2009;10645
77;CMNE ;Comando Militar do Nordeste;Exército;Estandarte;21/09/1995;22/09/1995;
78;CMN;Comando Militar do Norte;Exército;Estandarte;26/06/2013;21/09/2019;14264
79;CMO;Comando Militar do Oeste;Exército;Estandarte;19/10/2012;22/10/2012;11796
80;CMP;Comando Militar do Planalto;Exército;Bandeira;12/09/1990;11/10/1990;5815
81;CMSE;Comando Militar do Sudeste;Exército;Estandarte;24/07/1946;16/10/2018;13502
82;CMS;Comando Militar do Sul ;Exército;Estandarte;25/09/2008;26/09/2008;10013
83;CNB;Comando Naval de Brasília;Marinha;Estandarte;12/09/1990;11/10/1990;
84;CCEsq-Mar;Comando-em-Chefe da Esquadra;Marinha;Estandarte;01/09/1987;02/09/1987;5047
85;CGPM-SP;Comando-Geral da Polícia Militar do Estado de São Paulo;Polícia Militar;Estandarte;;22/10/2014;12481
86;COMGAP;Comando-Geral de Apoio;Aeronáutica;Estandarte;16/09/1998;17/09/1998;7567
87;COMGAR;Comando-Geral do Ar;Aeronáutica;Estandarte;20/09/1984;25/09/1984;4470
88;COMGEP;Comando-Geral do Pessoal;Aeronáutica;Estandarte;23/09/1993;15/10/1993;
89;CABW;Comissão Aeronáutica Brasileira em Washington;Aeronáutica;Estandarte;29/09/2009;30/09/2009;10646
90;CABE;Comissão Aeronáutica Brasileira na Europa;Aeronáutica;Estandarte;30/09/2010;01/10/2010;11067
91;COPAC;Comissão Coordenadora do Programa Aeronave de Combate;Aeronáutica;Estandarte;19/10/2012;22/10/2012;11797
92;COMARA;Comissão de Aeroportos da Região Amazônica;Aeronáutica;Estandarte;17/10/2002;18/10/2002;8590
93;CDA;Comissão de Desportos da Aeronáutica;Aeronáutica;Estandarte;02/10/2017;03/10/2017;13489
94;CISCEA;Comissão de Implantação do Sistema de Controle do Espaço Aéreo;Aeronáutica;Estandarte;02/10/2017;03/10/2017;13487
95;CPO;Comissão de Promoções de Oficiais;Aeronáutica;Estandarte;17/10/2002;18/10/2002;8591
96;COJAER;Consultoria Jurídica do Ministério da Aeronáutica;Aeronáutica;Estandarte;23/09/1997;24/09/1997;7123
97;CBRJ;Corpo de Bombeiros do Distrito Federal (RJ);Bombeiros;Bandeira;09/10/1956;11/10/1956;397
98;CBM-MT;Corpo de Bombeiros Militar (MT);CBM;Estandarte;04/10/2007;05/10/2007;10005
99;CBMPM-SP;Corpo de Bombeiros Militar da PM (SP);CBM;Estandarte;04/10/2007;05/10/2007;10004
100;CBM-DF;Corpo de Bombeiros Militar do Distrito Federal (BR);Bombeiros;Estandarte;01/09/1987;02/09/1987;5173
101;CFN;Corpo de Fuzileiros Navais;Marinha;Bandeira;11/10/1962;12/10/1962;901
102;10ª CiaECmb;Décima Companhia de Engenharia de Combate;Exército;Estandarte;01/10/2003;02/10/2003;8985
103;12ª Bda Inf (AMV);Décima Segunda Brigada de Infantaria Leve (Aeromóvel);Exército;Estandarte;26/09/2005;27/09/2005;9482
104;19° BC;Décimo Nono Batalhão de Caçadores;Exército;Estandarte;17/10/2002;18/10/2002;8597
105;11º GAAAe;Décimo Primeiro Grupo de Artilharia Antiaérea;Exército;Estandarte;16/09/1998;17/09/1998;7569
106;11° RCAV;Décimo Primeiro Regimento de Cavalaria;Exército;Bandeira;15/10/1963;16/10/1963;1193
107;DAC;Departamento de Aviação Civil;Aeronáutica;Estandarte;11/09/1996;12/09/1996;7117
108;DCT;DEPARTAMENTO DE CIÊNCIA E TECNOLOGIA;Exército;Estandarte;01/06/2005;;
109;DECEA;Departamento de Controle do Espaço Aéreo;Aeronáutica;Estandarte;26/09/2005;27/09/2005;9472
110;DECEX;Departamento de Educação e Cultura do Exército;Exército;Estandarte;21/10/2011;24/10/2011;
111;DEPENS;Departamento de Ensino da Aeronáutica;Aeronáutica;Estandarte;05/09/1988;20/09/1988;5308
112;DEPED;Departamento de Pesquisas e Desenvolvimento;Aeronáutica;Estandarte;23/09/1997;24/09/1997;7126
113;DCI;Depósito Central de Intendência;Aeronáutica;Estandarte;16/09/1986;22/09/1986;4937
114;DARJ;Depósito de Aeronáutica do Rio de Janeiro;Aeronáutica;Estandarte;16/09/1986;22/09/1986;4813
115;DTCEA SM;Destacamento de Controle do Espaço Aéreo de Santa Maria;Aeronáutica;Estandarte;21/10/2011;24/10/2011;
116;DIRAP;Diretoria de Administração do Pessoal;Aeronáutica;Estandarte;18/09/1991;25/09/1991;
117;DIRAERMAR;Diretoria de Aeronáutica da Marinha;Marinha;Estandarte;06/09/2004;08/09/2004;9232
118;DEPV;Diretoria de Eletrônica e Proteção ao Vôo;Aeronáutica;Estandarte;14/10/1992;15/10/1992;6264
119;DIRENG;Diretoria de Engenharia da Aeronáutica;Aeronáutica;Bandeira;18/08/1991;25/09/1991;
120;DIRINT;Diretoria de Intendência da Aeronáutica;Aeronáutica;Estandarte;21/09/1995;22/09/1995;
121;DIRMA;Diretoria de Material da Aeronáutica;Aeronáutica;Bandeira;18/09/1991;25/09/1991;
122;DIRSA;Diretoria de Saúde da Aeronáutica;Aeronáutica;Estandarte;07/10/1994;13/10/1994;
123;DSM;Diretoria de Saúde da Marinha;Marinha;Estandarte;30/09/2010;01/10/2010;11062
124;DGDNTM;Diretoria-Geral de Desenvolvimento Nuclear e Tecnológico da Marinha;Marinha;Estandarte;21/10/2022;21/10/2022;201
125;DGMM;Diretoria-Geral do Material da Marinha;Marinha;Estandarte;18/06/1968;22/09/2019;14263
126;DGN;DIRETORIA-GERAL DE NAVEGAÇÃO;Marinha;Estandarte;18/06/1968;;
127;DGPM;Diretoria-Geral do Pessoal da Marinha;Marinha;Estandarte;13/10/2020;14/10/2020;14571
128;DLR;DLR - Centro Aeroespacial Alemão;Governo da Alemanha;Bandeira;28/10/2013;28/10/2013;12111
129;EAer-Ex FR;Escola de Aeronáutica do Exército do Ar Francês;Exército Francês;Bandeira;22/04/1949;23/04/1949;104
130;EAer-UR;Escola de Aeronáutica do Uruguai;Força Aérea Uruguaia;Bandeira;03/09/1948;;70
131;EAOAR;Escola de Aperfeiçoamento de Oficiais da Aer.;Aeronáutica;Estandarte;20/10/1967;20/10/1967;1654
132;EACA;Escola de Artilharia de Costa e Antiaérea;Exército;Estandarte;05/09/1988;20/09/1988;5439
133;ECEMAR;Escola de Comando e Estado-Maior da Aeronáutica;Aeronáutica;Bandeira;09/10/1956;11/10/1956;398
134;EEAR;Escola de Especialistas de Aeronáutica;Aeronáutica;Estandarte;12/10/1955;15/10/1955;365
135;ECEME;Escola de Estado-Maior do Exército;Exército;Estandarte;25/04/1949;06/05/1949;133
136;EGN;Escola de Guerra Naval;Marinha;Bandeira;09/10/1956;11/10/1956;396
137;EIEsp-Ex;Escola de Instrução Especializada do Exército;Exército;Estandarte;16/09/1986;22/09/1986;4814
138;EOEIG;Escola de Oficiais-Esp. e de Infantaria de Guarda;Aeronáutica;Estandarte;14/10/1958;20/10/1958;583
139;ESA;Escola de Sargentos das Armas;Exército;Estandarte;23/09/1997;24/09/1997;7127
140;EMAv-CO;"Escola Militar de Av ""Marco Fidel Suarez"" Colômbia";Colômbia;Estandarte;03/03/1970;04/03/1970;1908
141;EN;Escola Naval;Marinha;Estandarte;02/10/1978;03/10/1978;3120
142;EPCAR;Escola Preparatória de Cadetes do Ar;Aeronáutica;Estandarte;14/10/1958;20/10/1958;582
143;ESD;Escola Superior de Defesa;Ministério da Defesa;Estandarte;21/10/2022;21/10/2022;201
144;ESG;Escola Superior de Guerra;Exército;Bandeira;16/10/1959;21/10/1959;635
145;EAS;Esquadrão Aeroterrestre de Salvamento;Aeronáutica;Estandarte;04/10/2007;05/10/2007;10001
146;EDA;Esquadrão de Demonstração Aérea;Aeronáutica;Estandarte;06/09/2004;08/09/2004;9233
147;EMCFA;Estado-Maior Conjunto das Forças Armadas;Ministério da Defesa;Estandarte;27/10/2013;27/10/2013;12105
148;EMAER;Estado-Maior da Aeronáutica;Aeronáutica;Bandeira;19/10/1970;19/10/1970;1910
149;EMA;Estado-Maior da Armada;Marinha;Estandarte;07/10/1994;13/10/1994;
150;EMFA;Estado-Maior das Forças Armadas;EMFA;Bandeira;20/09/1983;27/09/1983;4149
151;EME;Estado-Maior do Exército;Exército;Estandarte;30/09/2010;01/10/2010;11063
152;FAYS;Fazenda da Aeronáutica de Pirassununga;Aeronáutica;Estandarte;12/11/1948;16/10/2018;13505
153;FAP;Força Aérea Paraguaia;Exterior;Estandarte;06/09/2004;08/09/2004;9234
154;FundOs;Fundação Osório;Exército;Estandarte;19/10/1965;20/10/1965;1419
155;GSI-PR;Gabinete de Segurança Institucional da Presidência da República;Presidência;Estandarte;21/10/2022;21/10/2022;201
156;GABAER;Gabinete do Ministro da Aeronáutica;Aeronáutica;Estandarte;21/09/1995;22/09/1995;
157;GONFALÃO;Gonfalão da Força Expedicionária Brasileira na Itália;Exterior;Bandeira;30/09/2010;01/10/2010;11065
158;GONFALÃO;Gonfalão do Primeiro Grupo de Aviação de Caça (1º Gavca);Exterior;Estandarte;18/12/1943;13/10/2016;13157
159;GAP BR;Grupamento de Apoio de Brasília;Aeronáutica;Estandarte;25/09/2008;26/09/2008;10015
160;GptFNNA;Grupamento de Fuzileiros Navais de Natal;Marinha;Estandarte;01/10/2003;02/10/2003;8987
161;GTE;Grupo de Transporte Especial;Aeronáutica;Estandarte;14/10/1992;15/10/1992;6226
162;GEIV;Grupo Especial de Inspeção em Vôo;Aeronáutica;Estandarte;28/09/1999;29/09/1999;7759
163;HCA;Hospital Central da Aeronáutica;Aeronáutica;Estandarte;26/09/2005;27/09/2005;9474
164;HFA;HOSPITAL DAS FORÇAS ARMADAS;Exército;Estandarte;15/12/2017;;
165;HABE;Hospital de Aeronáutica de Belém;Aeronáutica;Estandarte;21/09/1995;22/09/1995;
166;HACO;Hospital de Aeronáutica de Canoas;Aeronáutica;Estandarte;20/09/1985;23/09/1985;4719
167;HARF;Hospital de Aeronáutica de Recife;Aeronáutica;Estandarte;11/09/1996;12/09/1996;7118
168;HASP;Hospital de Aeronáutica de São Paulo;Aeronáutica;Estandarte;26/09/2005;27/09/2005;9475
169;HAAF;Hospital de Aeronáutica dos Afonsos;Aeronáutica;Estandarte;21/09/1995;22/09/1995;
170;HFAG;Hospital de Força Aérea do Galeão;Aeronáutica;Estandarte;26/09/2005;27/09/2005;9485
171;ICRJ;Iate Clube do Rio de Janeiro;Outros;Bandeira;25/03/1920;23/09/2019;14268
172;IAE;Instituto de Aeronáutica e Espaço;Aeronáutica;Estandarte;25/10/2013;25/10/2013;12108
173;ILA;Instituto de Logística da Aeronáutica;Aeronáutica;Estandarte;02/10/2017;03/10/2017;13490
174;IPA;INSTITUTO DE PSICOLOGIA DA AERONÁUTICA;Aeronáutica;Estandarte;25/11/1988;;
175;INCAER;Instituto Histórico-Cultural da Aeronáutica;Aeronáutica;Estandarte;16/02/1996;21/10/2015;12830
176;IME;Instituto Militar de Engenharia;Exército;Estandarte;12/09/1990;11/10/1990;5817
177;ITA;Instituto Tecnológico de Aeronáutica;Aeronáutica;Estandarte;21/06/2007;22/10/2014;12478
178;JID;Junta Interamericana de Defesa;Exterior;Estandarte;30/03/1942;13/10/2016;13107
179;LAQFA;Laboratório Químico-Farmacêutico da Aeronáutica;Aeronáutica;Estandarte;26/09/2005;27/09/2005;9476
180;LDN;Liga da Defesa Nacional;Outros;Estandarte;04/10/2007;05/10/2007;10006
181;MINDEF;Ministério da Defesa;Outros;Bandeira;20/09/2006;21/09/2006;9496
182;MMA;Ministério da Marinha;Marinha;Estandarte;11/09/1996;12/09/1996;7120
183;MEX;Ministério do Exército;Exército;Estandarte;11/09/1996;12/09/1996;7121
184;MisTir;Missão Tiriós;Civil/Religiosa;Bandeira;14/10/1992;15/10/1992;6227
185;;Musée de L'Air et de L'Espace;Outros;;07/06/2006;08/06/2006;
186;MUSAL;Museu Aeroespacial;Aeronáutica;Estandarte;17/10/2002;18/10/2002;8592
187;NAelMG-Mar;Navio Aeródromo Minas Gerais;Marinha;Bandeira;19/10/1970;19/10/1970;1991
188;NAESPAULO;Navio-Aeródromo São Paulo;Marinha;Estandarte;26/09/2005;27/09/2005;9479
189;9º Btl Eng Cmb;Nono Batalhão de Engenharia de Combate - Batalhão Carlos Camisão;Exército;Estandarte;30/09/2010;01/10/2010;11064
190;9º DN;Nono Distrito Naval;Marinha;Estandarte;05/10/2021;06/10/2021;14887
191;NUHFAB;Núcleo do Hospital de Força Aérea de Brasília;Aeronáutica;Estandarte;26/09/2005;27/09/2005;9477
192;OABR;Odontoclínica de Aeronáutica de Brasília;Aeronáutica;Estandarte;26/09/2005;27/09/2005;9478
193;8º GAC Pqdt;Oitavo Grupo de Artilharia de Campanha Paraquedista;Exército;Estandarte;29/10/2013;29/10/2013;12107
194;PIPAR;Pagadoria de Inativos e Pensionistas da Aeronáutica;Aeronáutica;Estandarte;19/10/2012;22/10/2012;11799
195;PAMA GL;Parque de Material Aeroáutico do Galeão;Aeronáutica;Estandarte;09/09/2004;21/10/2015;12831
196;PAMA LS;Parque de Material Aeronáutico de Lagoa Santa;Aeronáutica;Estandarte;01/09/1987;02/09/1987;5045
197;PAMA RF;Parque de Material Aeronáutico de Recife;Aeronáutica;Estandarte;12/09/1990;11/10/1990;5819
198;PAMA SP;Parque de Material Aeronáutico de São Paulo;Aeronáutica;Estandarte;08/09/1989;22/09/1989;5528
199;PAMA AF;Parque de Material Aeronáutico dos Afonsos;Aeronáutica;Estandarte;20/09/1985;23/09/1985;4717
200;PM-DF;Polícia Militar do Distrito Federal;Polícia Militar;Estandarte;23/09/1993;15/10/1993;
201;PME-MG;Polícia Militar do Estado de Minas Gerais ;Polícia Militar;Estandarte;29/09/2009;30/09/2009;10650
202;PABR;Prefeitura de Aeronáutica de Brasília ;Aeronáutica;Estandarte;25/09/2008;26/09/2008;10017
203;PANT;Prefeitura de Aeronáutica de Natal;Aeronáutica;Estandarte;21/10/2022;21/10/2022;201
204;PARF;Prefeitura de Aeronáutica de Recife;Aeronáutica;Estandarte;26/06/1946;13/10/2016;13156
205;PASP;Prefeitura de Aeronáutica de São Paulo;Aeronáutica;Estandarte;21/10/2022;21/10/2022;201
206;PAGL;Prefeitura de Aeronáutica do Galeão;Aeronáutica;Estandarte;14/03/1951;24/09/2019;14267
207;1ª ALADA;Primeira Ala de Defesa Aérea;Aeronáutica;Bandeira;02/10/1978;03/10/1978;
208;1ª BAAAE;Primeira Brigada de Artilharia Anti Aérea;Exército;Estandarte;14/10/1992;15/10/1992;6225
209;I FAE;Primeira Força Aérea;Aeronáutica;Estandarte;03/07/2006;22/10/2014;12477
210;1º B Com Sl;Primeiro Batalhão de Comunicação de Selva;Exército;Estandarte;;22/10/2014;12480
211;1° BEngC-Ex;Primeiro Batalhão de Engenharia de Combate;Exército;Bandeira;23/10/1963;23/10/1963;1199
212;1° BFE;Primeiro Batalhão de Forças Especiais;Exército;Estandarte;04/10/2007;05/10/2007;10003
213;1 BFr-Ex;Primeiro Batalhão de Fronteiras;Exército;Bandeira;15/10/1963;16/10/1963;1194
214;CINDACTA 1;Primeiro Centro Integrado de Defesa Aérea e Controle de Trafego Aéreo;Aeronáutica;;23/09/1993;15/10/1993;
215;I COMAR;Primeiro Comando Aéreo Regional;Aeronáutica;Estandarte;18/09/1991;25/09/1991;
216;ESQDVF-1;Primeiro Esquadrão de Aviões de Interceptação e Ataque;Marinha;Estandarte;26/09/2005;27/09/2005;9480
217;1° Esqd C Mec;Primeiro Esquadrão de Cavalaria Leve - Esquadrão Tenente Amaro;Exército;Estandarte;26/09/2005;27/09/2005;9481
218;1º ESQDHS-1;Primeiro Esquadrão de Helicópteros Anti-Submarinos;Marinha;Bandeira;25/09/2008;26/09/2008;10016
219;ESQDHU-1;Primeiro Esquadrão de Helicópteros de Emprego Geral;Marinha;Estandarte;26/10/2013;26/10/2013;12106
220;ESQDHA-1;Primeiro Esquadrão de Helicópteros de Esclarecimento e Ataque;Marinha;Estandarte;29/09/2009;30/09/2009;10648
221;EsqdHI-1;Primeiro Esquadrão de Helicópteros de Instrução;Marinha;Estandarte;;22/10/2014;12479
222;1° ETA;Primeiro Esquadrão de Transporte Aéreo;Aeronáutica;Estandarte;23/09/1997;24/09/1997;7125
223;1°/10° GAV;Primeiro Esquadrão do Décimo Grupo de Aviação;Aeronáutica;;23/09/1993;15/10/1993;
224;1°/14° GAV;Primeiro Esquadrão do Décimo Quarto Grupo de Aviação;Aeronáutica;Estandarte;15/09/1982;01/10/1982;3910
225;1°/15° GAV;Primeiro Esquadrão do Décimo Quinto Grupo de Aviação;Aeronáutica;Estandarte;11/09/1996;12/09/1996;7122
226;1°/16° GAV;Primeiro Esquadrão do Décimo Sexto Grupo de Aviação;Aeronáutica;Estandarte;17/10/2002;18/10/2002;8594
227;1°/8° GAv;Primeiro Esquadrão do Oitavo Grupo de Aviação;Aeronáutica;Estandarte;06/09/2004;08/09/2004;9229
228;1º/1º GCC;Primeiro Esquadrão do Primeiro Grupo de Comunicação e Controle;Aeronáutica;Estandarte;19/12/1950;13/10/2016;13161
229;1°/1° GT;Primeiro Esquadrão do Primeiro Grupo de Transporte;Aeronáutica;Estandarte;16/09/1998;17/09/1998;7568
230;1°/4° GAV;Primeiro Esquadrão do Quarto Grupo de Aviação;Aeronáutica;Estandarte;07/10/1994;13/10/1994;
231;1º/5º Gav;Primeiro Esquadrão do Quinto Grupo de Aviação;Aeronáutica;Estandarte;05/10/1944;16/10/2018;13508
232;1º/2º GT;Primeiro Esquadrão do Segundo Grupo de Transporte;Aeronáutica;;28/09/1999;29/09/1999;7760
233;1º/7º GAv;Primeiro Esquadrão do Sétimo Grupo de Aviação;Aeronáutica;Estandarte;26/09/2000;27/09/2000;
234;1°/6° GAV;Primeiro Esquadrão do Sexto Grupo de Aviação;Aeronáutica;Estandarte;05/09/1988;20/09/1988;5438
235;1º GAAA;Primeiro Grupo de Artilharia Antiaérea;Exército;Estandarte;26/09/2000;27/09/2000;
236;1° GAVCA;Primeiro Grupo de Aviação de Caça;Aeronáutica;Bandeira;09/10/1956;11/10/1956;400
237;GAVEMB1;Primeiro Grupo de Aviação Embarcada;Aeronáutica;Estandarte;15/09/1981;22/09/1981;3805
238;1º GCC;Primeiro Grupo de Comunicação e Controle;Aeronáutica;Estandarte;19/10/2012;22/10/2012;11798
239;1° GDA;Primeiro Grupo de Defesa Aérea;Aeronáutica;Estandarte;07/10/1994;13/10/1994;
240;1º GTT;Primeiro Grupo de Transporte de Tropa;Aeronáutica;Estandarte;22/01/1958;25/09/2019;14266
241;QGPM-GB;Quartel General da Polícia Militar da Guanabara;Polícia Militar;Bandeira;19/10/1970;19/10/1970;1993
242;IV COMAR;Quarto Comando Aéreo Regional;Aeronáutica;;23/09/1993;15/10/1993;
243;4º/1º GCC;Quarto Esquadrão do Primeiro Grupo de Comunicações e Controle;Aeronáutica;Estandarte;29/09/2009;30/09/2009;10649
244;4º/7º GAV;Quarto Esquadrão do Sétimo Grupo de Aviação;Aeronáutica;Estandarte;30/09/2010;01/10/2010;11068
245;V FATA;Quinta Força Aérea de Transporte Aéreo;Aeronáutica;Estandarte;20/09/1985;23/09/1985;4718
246;V COMAR;Quinto Comando Aéreo Regional;Aeronáutica;Estandarte;21/09/1995;22/09/1995;
247;EsqdHU-5;Quinto Esquadrão de Helicópteros de Emprego Geral;Marinha;Estandarte;02/10/2017;03/10/2017;13492
248;5º ETA;Quinto Esquadrão de Transporte Aéreo;Aeronáutica;Estandarte;20/09/2006;21/09/2006;9499
249;5º/8º GAv;Quinto Esquadrão do Oitavo Grupo de Aviação;Aeronáutica;Estandarte;26/09/2000;27/09/2000;
250;5º/1º GCC;Quinto Esquadrão do Primeiro Grupo de Comunicações e Controle;Aeronáutica;Estandarte;21/10/2011;24/10/2011;
251;5º GAC Ap;Quinto Grupo de Artilharia de Campanha Autopropulsado;Exército;Estandarte;04/12/1987;21/10/2015;12832
252;RSD;Regimento Santos-Dumont;Exército;Estandarte;12/10/1964;12/10/1964;1271
253;SECIRM;Secretaria da Comissão Interministerial para Recursos do Mar do CMB;Marinha;Estandarte;21/10/2011;24/10/2011;
254;SEFA;Secretaria de Economia e Finanças;Aeronáutica;Bandeira;16/09/1998;17/09/1998;7565
255;SGM;Secretaria-Geral da Marinha;Marinha;Estandarte;;21/10/2015;12829
256;;Secretariat of the Air Force;Outros;Estandarte;26/09/2005;27/09/2005;9483
257;2º DE;Segunda Divisão do Exército;Exército;Estandarte;05/10/2021;06/10/2021;14888
258;2ª ELO;Segunda Esquadrilha de Ligação e Observação;Aeronáutica;Bandeira;28/09/1999;29/09/1999;7761
259;II FAE;Segunda Força Aérea;Aeronáutica;Estandarte;28/09/1999;29/09/1999;7762
260;2º BAvEx;Segundo Batalhão de Aviação do Exército;Exército;Estandarte;25/08/1993;13/10/2016;13160
261;2º BPC;Segundo Batalhão de Polícia de Choque SP - Marechal Mascarenhas de Moraes;Polícia Militar;Estandarte;13/10/2020;14/10/2020;14576
