262;II COMAR;Segundo Comando Aéreo Regional;Aeronáutica;Estandarte;08/09/1989;22/09/1989;5486
263;2°/10° GAV;Segundo do Décimo Grupo de Aviação;Aeronáutica;Estandarte;01/09/1987;08/09/1987;5046
264;2°/2° GT;Segundo do Segundo Grupo de Transporte;Aeronáutica;Estandarte;23/09/1997;24/09/1997;7124
265;2° EF;Segundo Esquadrão de Fragatas;Marinha;Bandeira;16/09/1998;17/09/1998;7566
266;HU-2;Segundo Esquadrão de Helicópteros de Emprego Geral;Marinha;Estandarte;18/09/1986;13/10/2016;13159
267;2º ETA;Segundo Esquadrão de Transporte Aéreo;Aeronáutica;Estandarte;21/10/2011;24/10/2011;
268;2º/8º GAV;Segundo Esquadrão do Oitavo Grupo de Aviação;Aeronáutica;Estandarte;25/09/2008;26/09/2008;10014
269;2º/1º GCC;Segundo Esquadrão do Primeiro Grupo de Comunicações e Controle;Aeronáutica;Estandarte;21/10/2011;24/10/2011;
270;2º/5º GAV;Segundo Esquadrão do Quinto Grupo de Aviação;Aeronáutica;Estandarte;24/10/2013;24/10/2013;12109
271;2° RCC;Segundo Regimento de Carros de Combate;Exército;Bandeira;26/09/2001;27/09/2001;8366
272;SRPV-SP;Serviço Regional de Proteção ao Voo de São Paulo;Aeronáutica;Estandarte;27/06/1947;16/10/2018;13506
273;7º BEC;Sétimo Batalhão de Engenharia de Combate;Exército;Estandarte;17/10/2002;18/10/2002;8598
274;VII COMAR;Sétimo Comando Aéreo Regional;Aeronáutica;Estandarte;01/10/2003;02/10/2003;8988
275;7º DN;Sétimo Distrito Naval;Marinha;Estandarte;12/09/1990;;5716
276;7º/8º GAV;Sétimo Esquadrão do Oitavo Grupo de Aviação;Aeronáutica;Estandarte;29/09/2009;30/09/2009;10647
277;6ª Div-Ex;Sexta Divisão de Exército - Divisão Voluntários da Pátria;Exército;Estandarte;01/09/1987;02/09/1987;5048
278;VI FAE;Sexta Força Aérea;Aeronáutica;Estandarte;14/10/1992;15/10/1992;6222
279;6º BgdIL;Sexto Batalhão de Infantaria Leve - Regimento Ipiranga;Exército;Estandarte;17/10/2002;18/10/2002;8596
280;VI COMAR;Sexto Comando Aéreo Regional;Aeronáutica;Bandeira;02/10/1978;03/10/1978;3118
281;6º ETA;Sexto Esquadrão de Transporte Aéreo;Aeronáutica;Estandarte;05/10/2021;06/10/2021;14890
282;SBC;Sociedade Brasileira de Cartografia;Outros;Estandarte;17/10/2002;18/10/2002;8593
283;STM;Superior Tribunal Militar;Forças Armadas;Bandeira;16/10/1957;23/10/1957;525
284;FAE III;Terceira Força Aérea;Aeronáutica;Estandarte;20/09/2006;21/09/2006;9497
285;3º B SUP;Terceiro Batalhão de Suprimento do Exército;Exército;Bandeira;28/09/1999;29/09/1999;7763
286;III COMAR;Terceiro Comando Aéreo Regional;Aeronáutica;Bandeira;15/09/1981;22/09/1981;3804
287;EsqdHU-3;Terceiro Esquadrão de Helicópteros de Emprego Geral;Marinha;Estandarte;31/01/1994;16/10/2018;13507
288;3º ETA;TERCEIRO ESQUADRÃO DE TRANSPORTE AÉREO;Aeronáutica;Estandarte;;;
289;3°/10° GAV;Terceiro Esquadrão do Décimo Grupo de Aviação;Aeronáutica;Estandarte;17/10/2002;18/10/2002;8595
290;3º/8º GAV;Terceiro Esquadrão do Oitavo Grupo de Aviação;Aeronáutica;Estandarte;13/10/2020;14/10/2020;14574
291;3º/1º GCC;Terceiro Esquadrão do Primeiro Grupo de Comunicações e Controle;Aeronáutica;Estandarte;30/09/2010;01/10/2010;11069
292;3º/7º GAV;Terceiro Esquadrão do Sétimo Grupo de Aviação;Aeronáutica;Estandarte;13/10/2020;14/10/2020;14575
293;3° GAAAÉ;Terceiro Grupo de Artilharia Antiaérea;Exército;Estandarte;23/09/1993;15/10/1993;
294;3° ROb 105-Ex;"Terceiro Regimento de Obuses 105 ""Regimento Mallet";Exército;Bandeira;25/10/1966;26/10/1966;1474
295;TCB;Touring Club do Brasil;Outros;Estandarte;28/09/1999;29/09/1999;7764
296;32° GAC;Trigésimo Segundo Grupo de Artilharia de Campanha - Bateria Caiena;Exército;Estandarte;06/09/2004;08/09/2004;9230
297;UNIFA;Universidade da Força Aérea;Aeronáutica;Estandarte;26/09/2001;27/09/2001;
298;20° GACL;Vigésimo Grupo de Artilharia de Campanha Leve - Grupo Bandeirante;Exército;Estandarte;20/09/2006;21/09/2006;9502
299;29° GAC-Ex;Vigésimo Nono Grupo de Artilharia de Campanha - Grupo Humaitá;Exército;Bandeira;05/10/1977;13/10/1977;
300;21° GAC;Vigésimo Primeiro Grupo de Artilharia de Campanha - Grupo Monte Bastione;Exército;Estandarte;20/09/2006;21/09/2006;9503
301;"	Com5ºDN";COMANDO DO 5º DISTRITO NAVAL;Marinha;Estandarte;18/10/2024;;18403
302;GAP-CO;GRUPAMENTO DE APOIO DE CANOAS;Aeronáutica;Estandarte;18/10/2024;;18404
303;2º/7º GAV;SEGUNDO ESQUADRÃO DO SÉTIMO GRUPO DE AVIAÇÃO;Aeronáutica;Estandarte;18/10/2024;;18405
304;CENSIPAM;CENTRO GESTOR E OPERACIONAL DO SISTEMA DE PROTEÇÃO DA AMAZÔNIA;Outros;Bandeira;18/10/2024;;18406
305;DEC;DEPARTAMENTO DE ENGENHARIA E CONSTRUÇÃO;Exército;Estandarte;18/10/2024;;18402
306;Com8ºDN;COMANDO DO 8º DISTRITO NAVAL;Marinha;Estandarte;22/10/2025;23/10/2025;18782
307;CCOMGEX;COMANDO DE COMUNICAÇÕES E GUERRA ELETRÔNICA DO EXÉRCITO;Exército;Estandarte;22/10/2025;23/10/2025;18783
308;CENCIAR;"CENTRO DE CONTROLE INTERNO DA AERONÁUTICA	";Aeronáutica;Estandarte;22/10/2025;23/10/2025;18787
309;DIREF;DIRETORIA DE ECONOMIA E FINANÇAS DA AERONÁUTICA;Aeronáutica;Estandarte;22/10/2025;23/10/2025;18784
310;CENDOC;CENTRO DE DOCUMENTAÇÃO DA AERONÁUTICA;Aeronáutica;Estandarte;22/10/2025;23/10/2025;18785
311;SERINFRA-CO;SERVIÇO REGIONAL DE INFRAESTRUTURA DA AERONÁUTICA DE CANOAS;Aeronáutica;Estandarte;22/10/2025;23/10/2025;18786
312;Mus Ar;MUSEU DO AR - PORTUGAL;Outros;Estandarte;22/10/2025;23/10/2025;18788
